Product Name,Product Price,Product Brand
"SWANSON L-ARGININAS, 500 mg, 100 kapsulių",13.49,Swanson
"ICONFIT, Dietinis kokteilis - Šokolado, 495g",14.99,Iconfit
"VIRIDIAN L-LYSINE, 500 mg, 30 kapsulių",13.99,Viridian
"SWANSON, 2000mg, maca, kapsulės, N60",11.99,Swanson
"VITAVEA Maksimali galia FORCE G POWER MAX, maisto papildas, 10 ampulių",19.49,VITAVEA
"ICONFIT, Dietinis kokteilis - Apelsinų, 495g",14.99,Iconfit
"RAW POWDERS BETAINAS HCL, 650 mg, 120 kapsulių",17.99,Raw Powders
NOW GABA 750 mg 100 Veg. Kapsulių,24.00,NOW Foods
Kazeinas ON™ Gold Standard Casein 924g Šokolado skonio,39.99,Optimum Nutrition
"RAW POWDERS TAURINAS, 500 mg, 100 kapsulių",12.49,Raw Powders
"ICONFIT, Mikronizuotas Kreatino Monohidratas - Nearomatizuotas, 300g",14.99,Iconfit
"VITAVEA Vynmedžio ir juodųjų serbentų ekstraktai normaliai kraujotakai, 40 kapsulių",15.49,VITAVEA
"SWANSON L-TIROZINAS, 500 mg, 100 kapsulių",14.52,Swanson
NOW Alpha Lipoic Acid 250mg 120 Veg. Kapsulių,32.59,NOW Foods
"DION SPORTLAB VEGAN PROTEIN,  Vanilės sk.,1000 g",31.39,Dion Sportlab
"ICONFIT, Augaliniai baltymai - Šokolado, 480g",14.99,Iconfit
"VIRIDIAN L-TRYPTOPHAN, 220 mg, 30 kapsulių",16.39,Viridian
"RAW POWDERS L-TEANINAS, 200 mg, 120 tablečių",14.89,Raw Powders
"DION SPORTLAB PROTEIN SHAKE Vanilės sk., 900 g",31.39,Dion Sportlab
"DION SPORTLAB FAT BURN Liquid, Tropikų sk., 1000 ml",31.29,Dion Sportlab
"GYMON, natūralaus skonio baltymų kokteilis, be laktozės, 450 g",16.25,GYMON
"RAW POWDERS CHOLINO BITARTRATO  milteliai, 250 g",20.79,Raw Powders
"ICONFIT BCAA 2:1:1, Amino Rūgštys - Apelsinų, 300g",12.99,Iconfit
"EQUILIBRA aminorūgštys BCAA (BRANCHED-CHAIN AMINO ACIDS), 100 tablečių",32.49,Equilibra
"ICONFIT, Augaliniai baltymai - Obuolių pyrago, 480g",14.99,Iconfit
"RAW POWDERS CHLORELLA 500 mg, 120 kapsulių",18.89,Raw Powders
NOW Alpha Lipoic Acid 250mg 60 Veg. Kapsulių,17.69,NOW Foods
ROYAL GREEN Išrūgų baltymų izoliatas 600g,43.99,ROYAL GREEN
"REBOOST After Sport, Vanilinis sk., 1050 g.",16.69,Dion Sportlab
"RAW POWDERS GARCINIA CAMBOGIA, 500 mg, 120 kapsulių",16.99,Raw Powders
"GO POWDERS GO MASS GAINERIS Masės augimo proteino kokteilis Sausainių ir grietinėlės skonio, 5 kg",74.95,Go Powders
Dymatize Kreatino Milteliai 300g,27.29,Dymatize
"RAW POWDERS ARGININAS ALFA-KETOGLUTARATAS, milteliai, 250g",20.59,Raw Powders
"GRENADE CARB KILLA BAR, baltyminiai batonėliai, balto šokolado sūdytų riešutų skonio, 12 x 60 g",35.00,Grenade®
"RAW POWDERS L-TEANINAS 200 mg, 180 kapsulių",18.95,Raw Powders
"RAW POWDERS CHOLINO BITARTRATAS, 700 mg, 120 kapsulių",19.55,Raw Powders
"GYMON, vanilės skonio baltymų kokteilis, 1 kg",26.72,GYMON
NOW L-Arginine 500mg 100 Veg. Kapsulių,13.69,NOW Foods
"DION SPORTLAB MUSCLE GAINER, Vanilės sk., 1250 g",31.39,Dion Sportlab
"RAW POWDERS KOFEINAS 200 mg, 200 tablečių",14.99,Raw Powders
"DION SPORTLAB L-CARNITINE 1500, Tropikų sk.,1000 ml",20.79,Dion Sportlab
"DION SPORTLAB SOY PROTEIN Neutralus sk., 800 g",23.99,Dion Sportlab
"RAW POWDERS L-LIZINO milteliai, 100 g",12.95,Raw Powders
Proteinogeninė aminorūgštis Dymatize Glutamino Milteliai 400g,37.99,Dymatize
NOW GABA 500mg 200 Veg. Kapsulių,26.79,NOW Foods
"GYMON, vanilės skonio baltymų kokteilis, be laktozės, 450 g",16.25,GYMON
"Sausainių su kremu skonio baltymų kokteilis, be laktozės, 450 g",16.25,GYMON
"NORDAID MAGNIS liposomose 200mg, serumas, 30pak.x10ml",52.90,Nordaid
"DION SPORTLAB CREATINE MALATE, Citrusų (Apelsinų-Greipfrutų-Laimo) sk., 300 g",31.29,Dion Sportlab
"ICONFIT, Mikronizuotas Kreatino Monohidratas - Apelsinų, 300g",14.99,Iconfit
"ICONFIT, Mikronizuotas Kreatino Monohidratas - Spanguolių, 300g",14.99,Iconfit
NOW GABA 500mg 100 Veg. Kapsulių,14.69,NOW Foods
"DION SPORTLAB BEEF PROTEIN, Vanilės sk., 750 g",41.59,Dion Sportlab
"DOPPELHERZ AKTIV SPORT DIRECT, 20 paketėlių",9.75,Doppelherz
"RAW POWDERS, kreatinas HCL, milteliai, 100g",15.95,Raw Powders
"GO POWDERS GABA, 500 mg, 100 kapsulių",20.59,Go Powders
"GYMON, braškių skonio baltymų kokteilis, 1 kg",26.72,GYMON
"ICONFIT BCAA 2:1:1,  Amino Rūgštys, Arbūzų, 300g",12.99,Iconfit
"DION SPORTLAB POWER, Greipfruto sk., 450 g",46.89,Dion Sportlab
"NORDAID IRON SPRAY, 5 mg, purškalas, 30 ml",20.99,Nordaid
Maisto produktas Cellucor Beta-Alaninas 330g,24.49,Cellucor
"EQUA elektrolitų gėrimas mėlynių skonio, 90 g, 20 pakelių po 4,5 g",22.49,EQUA
"DION SPORTLAB HYDRATE All Sports,Uogų sk., 1500 g",20.79,Dion Sportlab
"DION SPORTLAB MASS GAINER , Vanilės sk.,  1250 g",25.99,Dion Sportlab
"DION SPORTLAB PURE CREATINE, Beskonis, 100 g",8.39,Dion Sportlab
"DION SPORTLAB REBOOST After Sport, Vanilinis sk., 420 g",16.69,Dion Sportlab
"RAW POWDERS L-TRIPTOFANO milteliai, 100 g",18.95,Raw Powders
GymON Fitway sausainių ir grietinėlės skonio baltymų kokteilis,18.89,GYMON
"GYMON, šokolado skonio baltymų kokteilis, be laktozės, 450 g",16.25,GYMON
"ICONFIT, Beta Alaninas - Nearomatizuotas, 300g",11.99,Iconfit
"DION SPORTLAB FAT BURN Ice Tea, Greipfruto sk., 420 g",20.79,Dion Sportlab
"DION SPORTLAB GLUTAMINE, Beskonis, 300 g",18.89,Dion Sportlab
"GYMON, tropinio skonio baltymų kokteilis, 1 kg",26.72,GYMON
"GO POWDERS GO NATURAL, proteinas, braškių skonio, 1kg",39.99,Go Powders
"GO POWDERS GO NATURAL, proteinas, natūralaus skonio, 1kg",39.99,Go Powders
"ICONFIT BCAA 2:1:1  Amino Rūgštys - Obuolių, 300g",12.99,Iconfit
"ICONFIT BCAA 2:1:1,  Amino Rūgštys - Nearomatizuotas, 300g",12.99,Iconfit
"ICONFIT BCAA 2:1:1,  Amino Rūgštys - Spanguolių, 300g",12.99,Iconfit
"MAXIM 40% PROTEIN BAR, mėtų ir šokolado skonio baltymų batonėlis, 50 g",2.69,Maxim
"MAXIM COOKIE DOUGH, baltymų batonėlis, 55g",2.99,Maxim
"MAXIM, sūrios karamelės skonio baltymų batonėlis, 55 g",2.99,Maxim
"RAW POWDERS ACETIL L-KARNITINAS, kapsulės, N120",16.95,Raw Powders
"RAW POWDERS, Sporto kompleksas, skystas, 500ml",25.95,Raw Powders
"VIRIDIAN SPORTS FORMULA MULTIVITAMIN, 60 kapsulių",35.99,Viridian
NOW Alpha Lipoic Acid 100mg 120 Veg. Kapsulių,23.49,NOW Foods
Proteinas PhD Diet Whey 1KG Šokolado Skonio,42.00,PhD®
NOW Arginine Ir Ornithine 100 Veg. Kapsulių,28.49,NOW Foods
Proteinas PhD Diet Whey 1KG Braškių Skonio,42.00,PhD®
ROYAL GREEN BIO Išrūgų baltymai 600g,43.99,ROYAL GREEN
"RAW POWDERS, D-ASPARTAMO RŪGŠTIS, milteliai, 100g",15.95,Raw Powders
"GO POWDERS GO MASS GAINERIS Masės augimo proteino kokteilis Karamelės skonio, 5 kg",74.95,Go Powders
"GO POWDERS GO NATURAL, proteinas, šokolado skonio, 1kg",39.99,Go Powders
"Sausainių su kremu skonio baltymų kokteilis, 1 kg",26.72,GYMON
"RAW POWDERS L-TIROZINO milteliai, 100 g",18.95,Raw Powders
Olimp Vita-min Multiple Sport Mega 60 Kapsulių,16.99,Olimp
"GO POWDERS GO MASS GAINERIS Masės augimo proteino kokteilis Balto šokolado skonio, 5 kg",74.95,Go Powders
"GO POWDERS GO NATURAL, proteinas, karamelės skonio, 1kg",39.99,Go Powders
"DION SPORTLAB L-CARNITINE 3000, Citrinų sk., 1000 ml",31.39,Dion Sportlab
"ORTHOMOL SPORT PREPARE, 16 batonėlių",63.49,Orthomol
"RAW POWDERS L-FENILALANINO milteliai, 250 g",19.95,Raw Powders
Kreatinas ON™ Creatine 317g,27.49,Optimum Nutrition
"ORTHOMOL SPORT RECOVER, milteliai, 16 dienos porcijų",67.95,Orthomol
"ORTHOMOL SPORT, buteliukai, kapsulės ir tabletės, 30 dienos porcijų",74.95,Orthomol
Xtend Amino Rūgštys 30 Porcijų Vaisių Punšo skonio,34.99,Xtend
Dymatize Kreatino Milteliai 500g,38.99,Dymatize
Geineris ON™ Serious Mass 2.73kg Braškių skonio,49.99,Optimum Nutrition
"GO POWDERS GO MASS GAINERIS Masės augimo proteino kokteilis Bananų skonio, 5 kg",74.95,Go Powders
Maisto produktas Cellucor C4 Kreatinas 306g,30.99,Cellucor
"GO POWDERS GO MASS GAINERIS Masės augimo proteino kokteilis Šokolado skonio, 5 kg",74.95,Go Powders
"EQUA elektrolitų gėrimas citrinų ir žaliosios arbatos skonio, 90 g, 20 pakelių po 4,5 g",22.49,EQUA
Xtend Amino Rūgštys 30 Porcijų Mangų skonio,34.99,Xtend
"Sausainių skonio pieno išrūgų baltymų koncentrato milteliai su saldikliu, 1000 g",29.99,Diesema
"GO POWDERS GO MASS GAINERIS Masės augimo proteino kokteilis Braškių skonio, 5 kg",74.95,Go Powders
Xtend Amino Rūgštys 30 Porcijų Arbūzų skonio,34.99,Xtend
"GO POWDERS GO MASS GAINERIS Masės augimo proteino kokteilis Vanilės skonio, 5 kg",74.95,Go Powders
Xtend Amino Rūgštys 30 Porcijų Žaliųjų Citrinų skonio,34.99,Xtend
"VITAVEA Guarana, 19 vitaminų ir mineralų, 30 kapsulių",17.49,VITAVEA
Xtend Amino Rūgštys 30 Porcijų Obuolių skonio,34.99,Xtend
"VITAVEA Organizmo tonusui TONIFIANT, 40 kapsulių",15.49,VITAVEA
Xtend Amino Rūgštys 30 Porcijų Raudonųjų Apelsinų skonio,34.99,Xtend
